{
  "schema_version": "1.0",
  "manifest_id": "launchloop_synthetic_v1",
  "revision": 1,
  "created_at": "2026-08-24T12:00:00Z",
  "synthetic": true,
  "fixtures": {
    "ny_youth_day": {
      "kind": "event",
      "path": "fixtures/events/ny_youth_day.json",
      "sha256": "0123456789abcdef0123456789abcdef0123456789abcdef0123456789abcdef"
    }
  },
  "manifest_digest": "abcdef0123456789abcdef0123456789abcdef0123456789abcdef0123456789"
}